{
  "$schema": "https://json-schema.org/draft/2020-12/schema",
  "$id": "urn:srwf-kor:schema:public-release:v1",
  "title": "SRWF Korean accepted public release",
  "type": "object",
  "additionalProperties": false,
  "required": [
    "schema",
    "id",
    "state",
    "version",
    "title",
    "publishedAt",
    "source",
    "target",
    "patch",
    "provenance"
  ],
  "properties": {
    "schema": {
      "const": "srwf-kor.public-release.v1"
    },
    "id": {
      "type": "string",
      "pattern": "^[a-z0-9][a-z0-9._-]{0,63}$"
    },
    "state": {
      "const": "ACCEPTED"
    },
    "version": {
      "type": "string",
      "pattern": "^[A-Za-z0-9][A-Za-z0-9._-]{0,31}$"
    },
    "title": {
      "type": "string",
      "minLength": 1,
      "maxLength": 160,
      "pattern": "\\S"
    },
    "publishedAt": {
      "type": "string",
      "format": "date-time"
    },
    "source": {
      "oneOf": [
        {
          "type": "object",
          "additionalProperties": false,
          "required": [
            "profileId",
            "sha256",
            "size"
          ],
          "properties": {
            "profileId": {
              "const": "saturn-jp-stock-track01-mode1-2352-c198a930"
            },
            "size": {
              "const": 578512032
            },
            "sha256": {
              "const": "c198a93007d46161abe769b6f579f01cae89e23737c0a2ff38ec314d43b3adf8"
            }
          }
        },
        {
          "type": "object",
          "additionalProperties": false,
          "required": [
            "profileId",
            "sha256",
            "size"
          ],
          "properties": {
            "profileId": {
              "const": "saturn-jp-stock-track01-mode1-2352-ff7192ab"
            },
            "size": {
              "const": 520408224
            },
            "sha256": {
              "const": "ff7192abc112d5c969a0e236f5061fc6853234eedc350525c46c0548c57dfbdb"
            }
          }
        }
      ]
    },
    "target": {
      "type": "object",
      "additionalProperties": false,
      "required": [
        "filename",
        "cueFilename",
        "size",
        "sha256"
      ],
      "properties": {
        "filename": {
          "type": "string",
          "pattern": "^[A-Za-z0-9][A-Za-z0-9._-]*\\.bin$"
        },
        "cueFilename": {
          "type": "string",
          "pattern": "^[A-Za-z0-9][A-Za-z0-9._-]*\\.cue$"
        },
        "size": {
          "type": "integer",
          "minimum": 1,
          "maximum": 783216000
        },
        "sha256": {
          "type": "string",
          "pattern": "^[0-9a-f]{64}$"
        }
      }
    },
    "patch": {
      "oneOf": [
        {
          "type": "object",
          "additionalProperties": false,
          "required": [
            "format",
            "url",
            "size",
            "sha256",
            "recordCount",
            "bodyUncompressedSize"
          ],
          "properties": {
            "format": {
              "enum": [
                "srwf.sparse-byte-delta.v1",
                "srwf.sparse-byte-delta.v2"
              ]
            },
            "url": {
              "type": "string",
              "pattern": "^patches/[a-z0-9][a-z0-9._-]{0,63}\\.srwfp$"
            },
            "size": {
              "type": "integer",
              "minimum": 101,
              "maximum": 83886080
            },
            "sha256": {
              "type": "string",
              "pattern": "^[0-9a-f]{64}$"
            },
            "recordCount": {
              "type": "integer",
              "minimum": 1,
              "maximum": 2000000
            },
            "bodyUncompressedSize": {
              "type": "integer",
              "minimum": 14,
              "maximum": 134217728
            }
          }
        },
        {
          "type": "object",
          "additionalProperties": false,
          "required": [
            "format",
            "url",
            "size",
            "sha256",
            "recordCount",
            "bodyUncompressedSize",
            "variant",
            "commonRecordCount"
          ],
          "properties": {
            "format": {
              "const": "srwf.sparse-byte-delta.v3"
            },
            "url": {
              "type": "string",
              "pattern": "^patches/[a-z0-9][a-z0-9._-]{0,63}\\.v3\\.srwfp$"
            },
            "size": {
              "type": "integer",
              "minimum": 202,
              "maximum": 50331648
            },
            "sha256": {
              "type": "string",
              "pattern": "^[0-9a-f]{64}$"
            },
            "recordCount": {
              "type": "integer",
              "minimum": 1,
              "maximum": 2000000
            },
            "bodyUncompressedSize": {
              "type": "integer",
              "minimum": 3,
              "maximum": 100663296
            },
            "variant": {
              "enum": [
                "a",
                "b",
                "c"
              ]
            },
            "commonRecordCount": {
              "type": "integer",
              "minimum": 1,
              "maximum": 2000000
            }
          }
        }
      ]
    },
    "provenance": {
      "type": "object",
      "additionalProperties": false,
      "required": [
        "v5Commit",
        "buildReceiptSha256",
        "acceptanceReceiptSha256"
      ],
      "properties": {
        "v5Commit": {
          "type": "string",
          "pattern": "^(?:[0-9a-f]{40}|[0-9a-f]{64})$"
        },
        "buildReceiptSha256": {
          "type": "string",
          "pattern": "^[0-9a-f]{64}$"
        },
        "acceptanceReceiptSha256": {
          "type": "string",
          "pattern": "^[0-9a-f]{64}$"
        }
      }
    }
  },
  "allOf": [
    {
      "if": {
        "properties": {
          "patch": {
            "properties": {
              "format": {
                "const": "srwf.sparse-byte-delta.v1"
              }
            },
            "required": [
              "format"
            ]
          }
        },
        "required": [
          "patch"
        ]
      },
      "then": {
        "properties": {
          "target": {
            "properties": {
              "size": {
                "enum": [
                  578512032,
                  520408224
                ]
              }
            }
          },
          "patch": {
            "properties": {
              "bodyUncompressedSize": {
                "minimum": 45
              }
            }
          }
        }
      }
    },
    {
      "if": {
        "properties": {
          "patch": {
            "properties": {
              "format": {
                "const": "srwf.sparse-byte-delta.v2"
              }
            },
            "required": [
              "format"
            ]
          }
        },
        "required": [
          "patch"
        ]
      },
      "then": {
        "properties": {
          "target": {
            "properties": {
              "size": {
                "type": "integer",
                "multipleOf": 2352,
                "maximum": 783216000
              }
            }
          },
          "patch": {
            "properties": {
              "size": {
                "minimum": 129
              },
              "bodyUncompressedSize": {
                "minimum": 14
              }
            }
          }
        }
      }
    },
    {
      "if": {
        "properties": {
          "patch": {
            "properties": {
              "format": {
                "const": "srwf.sparse-byte-delta.v3"
              }
            },
            "required": [
              "format"
            ]
          }
        },
        "required": [
          "patch"
        ]
      },
      "then": {
        "properties": {
          "target": {
            "properties": {
              "size": {
                "enum": [
                  578512032,
                  520408224
                ]
              }
            }
          }
        }
      }
    }
  ]
}
