{
  "schema": "srwf-kor.public-release.v1",
  "id": "srwf-final-20261005-v0-3-c",
  "state": "ACCEPTED",
  "version": "v0.3",
  "title": "세가 새턴 슈퍼로봇대전 F 완결편 한글 패치 — 2026.10.05 v0.3 (c)",
  "publishedAt": "2026-10-05T02:57:06.688049+00:00",
  "source": {
    "profileId": "saturn-jp-stock-track01-mode1-2352-ff7192ab",
    "size": 520408224,
    "sha256": "ff7192abc112d5c969a0e236f5061fc6853234eedc350525c46c0548c57dfbdb"
  },
  "target": {
    "filename": "SRWFIN-KOR-20261005-v0.3-c.bin",
    "cueFilename": "SRWFIN-KOR-20261005-v0.3-c.cue",
    "size": 521680656,
    "sha256": "0fb10cbf4332f94c865c0e8d0a0c7234f8f6083bdbbb5a06198cebff871d195d"
  },
  "patch": {
    "format": "srwf.sparse-byte-delta.v2",
    "size": 3718378,
    "sha256": "f35cf3b4ec5d9da5dd864b86b42e993dd7c1648065d37f3717b4513829bfa87c",
    "recordCount": 85136,
    "bodyUncompressedSize": 7197902,
    "url": "patches/srwf-final-20261005-v0-3-c.srwfp"
  },
  "provenance": {
    "v5Commit": "084fed02ba4834ab5ff48b8c3e697f58b5fd4555ff1c17309c02a8d1817d03ff",
    "buildReceiptSha256": "c4a232a27df048084de7570bc60c3d3c80b5e13d8021edbbfe9ec8082dc22acb",
    "acceptanceReceiptSha256": "75d5199357c443589f226dec62c27d799adf775bd4d35acb5924c770eb85f39a"
  }
}
