{
  "schema": "srwf-kor.public-release.v1",
  "id": "srwf-f-20260928-v0-5-a",
  "state": "ACCEPTED",
  "version": "v0.5",
  "title": "세가 새턴 슈퍼로봇대전 F 한글 패치 — 2026.09.28 v0.5 (a)",
  "publishedAt": "2026-09-28T22:04:20+09:00",
  "source": {
    "profileId": "saturn-jp-stock-track01-mode1-2352-c198a930",
    "size": 578512032,
    "sha256": "c198a93007d46161abe769b6f579f01cae89e23737c0a2ff38ec314d43b3adf8"
  },
  "target": {
    "filename": "SRWF-KOR-20260928-v0.5-a.bin",
    "cueFilename": "SRWF-KOR-20260928-v0.5-a.cue",
    "size": 578512032,
    "sha256": "b2a67ed2a409c95de7226d33f2ab934012e93199afb7284bb710c81b6f0223b9"
  },
  "patch": {
    "format": "srwf.sparse-byte-delta.v1",
    "size": 69587546,
    "sha256": "a309a7951effdbde05d5bd4c853eb41ccd8a5b00bb2be8a57df380734f28df59",
    "recordCount": 1330782,
    "bodyUncompressedSize": 95142058,
    "url": "patches/srwf-f-20260928-v0-5-a.srwfp"
  },
  "provenance": {
    "v5Commit": "ea1076d778df77815a4ac448ac2a21ec3d7ace8b",
    "buildReceiptSha256": "6b6cc021545364f06b109fa31cfbe50d68bad573745da6cb54bba2d2dbdf3932",
    "acceptanceReceiptSha256": "6241ba3f5c04aa98209222130cbd008b5afa44b5e734201a08ac5e4ebb52de78"
  }
}
