{
  "schema": "srwf-kor.public-release.v1",
  "id": "srwf-f-20260928-v0-5-c",
  "state": "ACCEPTED",
  "version": "v0.5",
  "title": "세가 새턴 슈퍼로봇대전 F 한글 패치 — 2026.09.28 v0.5 (c)",
  "publishedAt": "2026-09-28T22:04:20+09:00",
  "source": {
    "profileId": "saturn-jp-stock-track01-mode1-2352-c198a930",
    "size": 578512032,
    "sha256": "c198a93007d46161abe769b6f579f01cae89e23737c0a2ff38ec314d43b3adf8"
  },
  "target": {
    "filename": "SRWF-KOR-20260928-v0.5-c.bin",
    "cueFilename": "SRWF-KOR-20260928-v0.5-c.cue",
    "size": 578512032,
    "sha256": "75555116f784115e7104c593fd990491ae182b9493d9f159201e17b3e3d88202"
  },
  "patch": {
    "format": "srwf.sparse-byte-delta.v1",
    "size": 69592331,
    "sha256": "9981ea581a400807fbc6dc6c935dba39f18615f0223ded23c4675ed7f5d78f1d",
    "recordCount": 1330842,
    "bodyUncompressedSize": 95144635,
    "url": "patches/srwf-f-20260928-v0-5-c.srwfp"
  },
  "provenance": {
    "v5Commit": "ea1076d778df77815a4ac448ac2a21ec3d7ace8b",
    "buildReceiptSha256": "9e9d846f3bb39cca26b117bad2c3594f1da398261d2069cd2f72fd9479648f1a",
    "acceptanceReceiptSha256": "08b0cf5db0aa1e669dfc4c6a4a4db8b9a5ba988a9cd86372b34a90113d102bf3"
  }
}
