{
  "schema": "srwf-kor.public-release.v1",
  "id": "srwf-f-20260928-v0-5-b",
  "state": "ACCEPTED",
  "version": "v0.5",
  "title": "세가 새턴 슈퍼로봇대전 F 한글 패치 — 2026.09.28 v0.5 (b)",
  "publishedAt": "2026-09-28T22:04:20+09:00",
  "source": {
    "profileId": "saturn-jp-stock-track01-mode1-2352-c198a930",
    "size": 578512032,
    "sha256": "c198a93007d46161abe769b6f579f01cae89e23737c0a2ff38ec314d43b3adf8"
  },
  "target": {
    "filename": "SRWF-KOR-20260928-v0.5-b.bin",
    "cueFilename": "SRWF-KOR-20260928-v0.5-b.cue",
    "size": 578512032,
    "sha256": "85b9cbf349c421d621f3a6e6819d94f9ee1405137430046469562a2176e798a3"
  },
  "patch": {
    "format": "srwf.sparse-byte-delta.v1",
    "size": 69588190,
    "sha256": "0a49422528c142bd24cbbf975fdcfb4f09f059069e5025e48e81ad8efae70345",
    "recordCount": 1330773,
    "bodyUncompressedSize": 95141669,
    "url": "patches/srwf-f-20260928-v0-5-b.srwfp"
  },
  "provenance": {
    "v5Commit": "ea1076d778df77815a4ac448ac2a21ec3d7ace8b",
    "buildReceiptSha256": "1c817fd6f32026c2b59965a986ac3efa0fb64da1353cd7b05a29b3d38300cc2f",
    "acceptanceReceiptSha256": "b21f2d8979e54eabefe75a77d0d42b7eb15231c71594784306d70c43c0ef6d56"
  }
}
