{
  "schema": "srwf-kor.public-release.v1",
  "id": "srwf-f-20260814-v0-1-1",
  "state": "ACCEPTED",
  "version": "v0.1.1",
  "title": "세가 새턴 슈퍼로봇대전 F 한글 패치 — 2026.08.14 v0.1.1",
  "publishedAt": "2026-08-14T01:56:17Z",
  "source": {
    "profileId": "saturn-jp-stock-track01-mode1-2352-c198a930",
    "size": 578512032,
    "sha256": "c198a93007d46161abe769b6f579f01cae89e23737c0a2ff38ec314d43b3adf8"
  },
  "target": {
    "filename": "SRWF-KOR-20260814-v0.1.1.bin",
    "cueFilename": "SRWF-KOR-20260814-v0.1.1.cue",
    "size": 578512032,
    "sha256": "b6364d14688f6dc68dfc4199f144c102de2061eea49f81e482276a620eff1e1c"
  },
  "patch": {
    "format": "srwf.sparse-byte-delta.v1",
    "url": "patches/srwf-f-20260814-v0-1-1.srwfp",
    "size": 5238673,
    "sha256": "a63a985113caef05152e828776330a0b19000d1b970e428aeb72378100cf7a2c",
    "recordCount": 160748,
    "bodyUncompressedSize": 10641001
  },
  "provenance": {
    "v5Commit": "b7e60d5fb259dae32223702e5e237b23883aec48",
    "buildReceiptSha256": "d89e027a837daadabb16b1fb9a009d3c8e9c41d20560528fbf91b6615face147",
    "acceptanceReceiptSha256": "c540f4211dea035319685c78413638ca5cc30be0c126dd4e725fc1e524b93860"
  }
}
