{
  "schema": "srwf-kor.public-release.v1",
  "id": "srwf-final-20260921-v0-1-c",
  "state": "ACCEPTED",
  "version": "v0.1",
  "title": "세가 새턴 슈퍼로봇대전 F 완결편 한글 패치 — 2026.09.21 v0.1 (c)",
  "publishedAt": "2026-09-21T00:00:00+09:00",
  "source": {
    "profileId": "saturn-jp-stock-track01-mode1-2352-ff7192ab",
    "size": 520408224,
    "sha256": "ff7192abc112d5c969a0e236f5061fc6853234eedc350525c46c0548c57dfbdb"
  },
  "target": {
    "filename": "SRWFIN-KOR-20260921-v0.1-c.bin",
    "cueFilename": "SRWFIN-KOR-20260921-v0.1-c.cue",
    "size": 521680656,
    "sha256": "b6ddb95cb6c8a053106a5e169ad8d366d73f070a184465e031ca94054a6424df"
  },
  "patch": {
    "format": "srwf.sparse-byte-delta.v2",
    "url": "patches/srwf-final-20260921-v0-1-c.srwfp",
    "size": 3670267,
    "sha256": "d5c9ccd47072a8794115095c93fb9bff57e3f9bd5d029baacda0a26d251e402b",
    "recordCount": 83946,
    "bodyUncompressedSize": 7140667
  },
  "provenance": {
    "v5Commit": "0781ed99537c6d72762a7efc426653eb6ff3d4ee",
    "buildReceiptSha256": "e6a885a4c269bb5c83bf3f9afc134b9e671ceb70890f342cc2e8ac8ab5933258",
    "acceptanceReceiptSha256": "bac09677c8a5737113e749f36de008034626d598cfcdd54c1ffd634308068d11"
  }
}
