{
  "schema": "srwf-kor.public-release.v1",
  "id": "srwf-f-20260915-v0-4-a",
  "state": "ACCEPTED",
  "version": "v0.4",
  "title": "세가 새턴 슈퍼로봇대전 F 한글 패치 — 2026.09.15 v0.4 (a)",
  "publishedAt": "2026-09-15T13:27:46+09:00",
  "source": {
    "profileId": "saturn-jp-stock-track01-mode1-2352-c198a930",
    "size": 578512032,
    "sha256": "c198a93007d46161abe769b6f579f01cae89e23737c0a2ff38ec314d43b3adf8"
  },
  "target": {
    "filename": "SRWF-KOR-20260915-v0.4-a.bin",
    "cueFilename": "SRWF-KOR-20260915-v0.4-a.cue",
    "size": 578512032,
    "sha256": "f3292551e827ac66d4406a2994350342d9084a5d24a121a70185029fba574a3e"
  },
  "patch": {
    "format": "srwf.sparse-byte-delta.v1",
    "url": "patches/srwf-f-20260915-v0-4-a.srwfp",
    "size": 63992864,
    "sha256": "f31ffbd24da40bc4355fa14878d0d24d80887e4ea2a6d88409099c9568ded0de",
    "recordCount": 1257063,
    "bodyUncompressedSize": 91867210
  },
  "provenance": {
    "v5Commit": "ea1076d778df77815a4ac448ac2a21ec3d7ace8b",
    "buildReceiptSha256": "928a61cd795f6de08b31ffa0ba3945bc6f32090f5a02784f87ff503085b6e1fa",
    "acceptanceReceiptSha256": "8de9609f460d7696d1d2e6c1c58a3ba31464140d2c7b5497c5a304459366d017"
  }
}
