{
 "schema": "srwf-kor.public-release.v1",
 "id": "srwf-f-20260821-v0-2",
 "state": "ACCEPTED",
 "version": "v0.2",
 "title": "세가 새턴 슈퍼로봇대전 F 한글 패치 — 2026.08.21 v0.2",
 "publishedAt": "2026-08-21T08:16:36+09:00",
 "source": {
  "profileId": "saturn-jp-stock-track01-mode1-2352-c198a930",
  "size": 578512032,
  "sha256": "c198a93007d46161abe769b6f579f01cae89e23737c0a2ff38ec314d43b3adf8"
 },
 "target": {
  "filename": "SRWF-KOR-20260821-v0.2.bin",
  "cueFilename": "SRWF-KOR-20260821-v0.2.cue",
  "size": 578512032,
  "sha256": "9f9f3ecd1069d8748060e615952b4710eed24f68f549ac74f69d42f572924eba"
 },
 "patch": {
  "format": "srwf.sparse-byte-delta.v1",
  "url": "patches/srwf-f-20260821-v0-2.srwfp",
  "size": 17901814,
  "sha256": "123f204e29625bf4fd2a360a192a6b2eae12bb7ff88633031a8cc17b88984580",
  "recordCount": 446,
  "bodyUncompressedSize": 38515821
 },
 "provenance": {
  "v5Commit": "ea1076d778df77815a4ac448ac2a21ec3d7ace8b",
  "buildReceiptSha256": "6d0f6423d787a479de5e09e056e36b0d80980b1390e70b01081c78e6897fd715",
  "acceptanceReceiptSha256": "26e218a22c6c675badc295e73abebf0902091abfc325b6d91e813aa3e007ca95"
 }
}
