{
  "schema": "srwf-kor.public-release.v1",
  "id": "srwf-f-20260815-v0-1-2",
  "state": "ACCEPTED",
  "version": "v0.1.2",
  "title": "세가 새턴 슈퍼로봇대전 F 한글 패치 — 2026.08.15 v0.1.2",
  "publishedAt": "2026-08-15T08:30:54+09:00",
  "source": {
    "profileId": "saturn-jp-stock-track01-mode1-2352-c198a930",
    "size": 578512032,
    "sha256": "c198a93007d46161abe769b6f579f01cae89e23737c0a2ff38ec314d43b3adf8"
  },
  "target": {
    "filename": "SRWF-KOR-20260815-v0.1.2.bin",
    "cueFilename": "SRWF-KOR-20260815-v0.1.2.cue",
    "size": 578512032,
    "sha256": "12a9614e16ffc9b0020bb2536ccc2f4b8dddcd9619ff6a24823d86cfc87ea27e"
  },
  "patch": {
    "format": "srwf.sparse-byte-delta.v1",
    "url": "patches/srwf-f-20260815-v0-1-2.srwfp",
    "size": 5238675,
    "sha256": "c4949a301f2444659d877d27e88680592c52dd813cf0f3b612e17a7f69becd8d",
    "recordCount": 160748,
    "bodyUncompressedSize": 10641001
  },
  "provenance": {
    "v5Commit": "2c1ac6245d71eeb769b637bcc568f42b05530773",
    "buildReceiptSha256": "40985668983381e53a0d97361f091c18b8b280af2a92a5e3daf473cf95e9b858",
    "acceptanceReceiptSha256": "656c555eadf05dd09363dae61472536edfd7096f35b585a405cf48d0f9d8e719"
  }
}
