{
  "schema": "srwf-kor.public-release.v1",
  "id": "srwf-f-20260810-preview",
  "state": "ACCEPTED",
  "version": "v0.1-preview.1",
  "title": "세가 새턴 슈퍼로봇대전 F 한글 패치 — 2026.08.10 이전 프리뷰",
  "publishedAt": "2026-08-09T15:55:36Z",
  "source": {
    "profileId": "saturn-jp-stock-track01-mode1-2352-c198a930",
    "size": 578512032,
    "sha256": "c198a93007d46161abe769b6f579f01cae89e23737c0a2ff38ec314d43b3adf8"
  },
  "target": {
    "filename": "SRWF-KOR-20260810-preview.img",
    "cueFilename": "SRWF-KOR-20260810-preview.cue",
    "size": 578512032,
    "sha256": "2dc6168afca91daccb6ac48a3473dd6969831c152e91535c47448579da29a26a"
  },
  "patch": {
    "format": "srwf.sparse-byte-delta.v1",
    "url": "patches/srwf-f-20260810-preview.srwfp",
    "size": 3596477,
    "sha256": "718ac1042dbb4c5a104b1088ddcd937d9608a44367fd7b8e7eeaf3bb0beb4d61",
    "recordCount": 50881,
    "bodyUncompressedSize": 4517451
  },
  "provenance": {
    "v5Commit": "db6b57af028882ae0e7a3afd0305906f836e33d0",
    "buildReceiptSha256": "016a3e62a1940e0d55d815bbeb1b421a9c225737c87ec979ae1a018dc2caef0a",
    "acceptanceReceiptSha256": "7abe8d53be8c1b5f9b4befce2efc3514ab28215131d8f635f4bc678b43be08b6"
  }
}
